{
  "company_name": "Civica Transit Authority",
  "title": "Head of PMO",
  "role_family": "project_program",
  "level": "staff_principal",
  "level_label": "Head of PMO",
  "team": "PMO",
  "location": "Minneapolis, MN",
  "must_have_skills": [
    "12+ years in project and portfolio management",
    "Experience leading a PMO",
    "Public sector projects"
  ],
  "nice_to_have_skills": [
    "PMP or PgMP"
  ],
  "responsibilities": [
    "Lead the project management office",
    "Set portfolio governance and reporting",
    "Manage a team of 8 project managers",
    "Advise leadership on priorities and risk"
  ],
  "source_url": null
}
