{
  "company_name": "Fernway Energy",
  "title": "Chief of Staff to the CEO",
  "role_family": "consulting_strategy",
  "level": "senior",
  "level_label": null,
  "team": null,
  "location": "Houston, TX",
  "must_have_skills": [
    "7+ years in consulting, strategy or operations",
    "Experience working with executives",
    "Strong writing and analysis"
  ],
  "nice_to_have_skills": [
    "Energy industry experience"
  ],
  "responsibilities": [
    "Run the leadership team's operating rhythm",
    "Lead special projects for the CEO",
    "Prepare board materials",
    "Turn company strategy into team goals"
  ],
  "source_url": null
}
