{
  "company_name": "Pinecrest Hospitality",
  "title": "Controller",
  "role_family": "finance",
  "level": "senior",
  "level_label": "Controller",
  "team": null,
  "location": "Phoenix, AZ",
  "must_have_skills": [
    "CPA",
    "8+ years in accounting, 3+ managing a team",
    "Multi-entity consolidation",
    "GAAP"
  ],
  "nice_to_have_skills": [
    "Hospitality industry experience"
  ],
  "responsibilities": [
    "Lead the month-end and year-end close",
    "Manage a team of 6 accountants",
    "Own internal controls",
    "Work with external auditors"
  ],
  "source_url": null
}
