{
  "company_name": "Oakline Insurance",
  "title": "Senior Program Manager, Operations",
  "role_family": "project_program",
  "level": "senior",
  "level_label": "Senior",
  "team": "Operations",
  "location": "Hartford, CT",
  "must_have_skills": [
    "7+ years in program or project management",
    "Experience leading change programs",
    "Stakeholder management"
  ],
  "nice_to_have_skills": [
    "Insurance industry experience",
    "PgMP or PMP"
  ],
  "responsibilities": [
    "Lead a program of 5 projects across claims and customer service",
    "Build the program plan and track milestones",
    "Manage risks and dependencies across teams",
    "Report to the operations leadership team"
  ],
  "source_url": null
}
